{
  "$schema": "https://raw.githubusercontent.com/jiordiviera/php-ui/main/schema/registry-item.json",
  "name": "code-snippet",
  "type": "registry:ui",
  "description": "Code snippet component with syntax highlighting, line numbers, and copy functionality.",
  "categories": ["ui", "data", "text"],
  "dependencies": {
    "composer": ["mallardduck/blade-lucide-icons"],
    "npm": []
  },
  "registryDependencies": [],
  "files": {
    "code-snippet.blade.php.stub": "code-snippet.blade.php"
  },
  "css_vars": {},
  "tailwind": {
    "config": {
      "theme": {
        "extend": {}
      }
    }
  }
}