{
  "$schema": "https://raw.githubusercontent.com/jiordiviera/php-ui/main/schema/registry-item.json",
  "name": "empty-state",
  "type": "registry:ui",
  "description": "Empty state component with icon, title, description, and optional action button.",
  "categories": ["ui", "feedback", "layout"],
  "dependencies": {
    "composer": ["mallardduck/blade-lucide-icons"],
    "npm": []
  },
  "registryDependencies": [],
  "files": {
    "empty-state.blade.php.stub": "empty-state.blade.php"
  },
  "css_vars": {},
  "tailwind": {
    "config": {
      "theme": {
        "extend": {}
      }
    }
  }
}