{
  "$schema": "https://raw.githubusercontent.com/jiordiviera/php-ui/main/schema/registry-item.json",
  "name": "data-table",
  "type": "registry:ui",
  "description": "Feature-rich data table with search, sorting, filtering, pagination, and loading states.",
  "categories": ["ui", "data", "forms"],
  "dependencies": {
    "composer": ["mallardduck/blade-lucide-icons"],
    "npm": []
  },
  "registryDependencies": [],
  "files": {
    "data-table.blade.php.stub": "data-table.blade.php"
  },
  "css_vars": {},
  "tailwind": {
    "config": {
      "theme": {
        "extend": {}
      }
    }
  }
}