{
  "$schema": "https://raw.githubusercontent.com/jiordiviera/php-ui/main/schema/registry-item.json",
  "name": "progress-bar",
  "type": "registry:ui",
  "description": "Progress bar component with variants, sizes, and percentage display.",
  "categories": ["ui", "feedback", "data"],
  "dependencies": {
    "composer": ["mallardduck/blade-lucide-icons"],
    "npm": []
  },
  "registryDependencies": [],
  "files": {
    "progress-bar.blade.php.stub": "progress-bar.blade.php"
  },
  "css_vars": {},
  "tailwind": {
    "config": {
      "theme": {
        "extend": {}
      }
    }
  }
}