{
  "$schema": "https://raw.githubusercontent.com/jiordiviera/php-ui/main/schema/registry-item.json",
  "name": "alert",
  "type": "registry:ui",
  "description": "Alert component with variants, icons, and optional dismissible functionality.",
  "categories": ["ui", "feedback", "interactive"],
  "dependencies": {
    "composer": ["mallardduck/blade-lucide-icons"],
    "npm": []
  },
  "registryDependencies": [],
  "files": {
    "alert.blade.php.stub": "alert.blade.php"
  },
  "css_vars": {},
  "tailwind": {
    "config": {
      "theme": {
        "extend": {}
      }
    }
  }
}