{
  "$schema": "https://raw.githubusercontent.com/jiordiviera/php-ui/main/schema/registry-item.json",
  "name": "toggle",
  "type": "registry:ui",
  "description": "Toggle switch component with multiple sizes and accessibility features.",
  "categories": ["ui", "forms", "interactive"],
  "dependencies": {
    "composer": ["mallardduck/blade-lucide-icons"],
    "npm": []
  },
  "registryDependencies": [],
  "files": {
    "toggle.blade.php.stub": "toggle.blade.php"
  },
  "css_vars": {},
  "tailwind": {
    "config": {
      "theme": {
        "extend": {}
      }
    }
  }
}