{
  "$schema": "https://raw.githubusercontent.com/jiordiviera/php-ui/main/schema/registry-item.json",
  "name": "tooltip",
  "type": "registry:ui",
  "description": "Tooltip component with configurable positioning and delay settings.",
  "categories": ["ui", "overlay", "feedback"],
  "dependencies": {
    "composer": ["mallardduck/blade-lucide-icons"],
    "npm": []
  },
  "registryDependencies": [],
  "files": {
    "tooltip.blade.php.stub": "tooltip.blade.php"
  },
  "css_vars": {},
  "tailwind": {
    "config": {
      "theme": {
        "extend": {}
      }
    }
  }
}