{
  "$schema": "https://raw.githubusercontent.com/jiordiviera/php-ui/main/schema/registry-item.json",
  "name": "drawer",
  "type": "registry:ui",
  "description": "Slide-out drawer panel with multiple positions and overlay support.",
  "categories": ["ui", "overlay", "layout"],
  "dependencies": {
    "composer": ["mallardduck/blade-lucide-icons"],
    "npm": []
  },
  "registryDependencies": [],
  "files": {
    "drawer.blade.php.stub": "drawer.blade.php"
  },
  "css_vars": {},
  "tailwind": {
    "config": {
      "theme": {
        "extend": {}
      }
    }
  }
}