{
  "$schema": "https://raw.githubusercontent.com/jiordiviera/php-ui/main/schema/registry-item.json",
  "name": "progress-steps",
  "type": "registry:ui",
  "description": "Progress steps component with clickable steps, labels, and descriptions.",
  "categories": ["ui", "navigation", "feedback"],
  "dependencies": {
    "composer": ["mallardduck/blade-lucide-icons"],
    "npm": []
  },
  "registryDependencies": [],
  "files": {
    "progress-steps.blade.php.stub": "progress-steps.blade.php"
  },
  "css_vars": {},
  "tailwind": {
    "config": {
      "theme": {
        "extend": {}
      }
    }
  }
}